Order,Title,URL,Published_Date,Reads,Votes,Comments,Chapter_Text
21,Homecoming,https://www.wattpad.com/1538667318-a-love-twice-told-ishman-shubish-homecoming,"Sat, May 3, 2025",1290,91,21,"The confession was sweet, and it had left Ishan with a quiet kind of joy—the kind that settles deep in your chest and makes everything feel a little softer, a little lighter. He had been thinking about Shubman, about the confession that he had made since the England tour.

No matter how much he tried to ignore it, the overthinking came back to him every day. The thoughts of losing himself in search of something more had been haunting his dreams for some time now, but he also knew that the pushing back of the thoughts, the deliberate changing of focus, wasn't just because he didn't want to accept his feelings. Ishan was scared. Scared to hurt shubman--- again.

Ishan had known that something was charging between him and Shubman for some time now. He was trying to turn a blind eye to it, was trying to be as oblivious as possible, but there was no denying the fact that he had noticed the subtle touches and longing looks that Shubman threw his way.

Shubman...his shubman. Ishan knew him the best. Ishan would know if he was feeling uncomfortable even in the slightest without Shubman having to explicitly say it in words. Between him and Shubman, words had been overrated anyway. Shubman could take 0.02 seconds more to answer a question, and Ishan would know that there was something wrong.

Of course, he knew when Shubman started to feel something more than friendship towards him. At first, it had been a fleeting doubt, one that would often arise during an interview or maybe a net practice. A doubt that gave way to no further thinking or any kind of discomfort.

Then Ishan started to notice, along with the world, the prolonged stares and the touches that lasted longer than expected. The way Shubman's eyes found him in the crowd didn't feel the same as before; there was something different about the way Shubman reacted to his touches now.

Ishan had known; he had always known. It was his shubman after all. There was something desperate with the way Ishan went out of his way to avoid Shubman in the last few weeks before Shubman's accident. Don't get him wrong; he wasn't disgusted by Shubman or his feelings. No, Ishan was not disgusted or repelled. He was scared.

Ishan was scared of his own heart sometimes. He was scared that he would unknowingly hurt Shubman. He had thoughts, thoughts that would take up his entire nights and the majority of his consciousness and still wouldn't die down. Thoughts of harming their friendship in any way felt like torture beyond words for Ishan.

He had always thanked the heavens for Shubman. In the world of this competitive sport, he had not only gotten himself a close friend, a partner in crime, a loyal mate, or a personal cheerleader; no, Ishan had gotten himself home.

The late-night gossip, the ice cream parlor trips, the nightly movie marathons, and the religious phone calls had all hit home for Ishan, and he wouldn't trade them for anything. Not even the idea of having Shubman as something more could convince Ishan to risk a potential chance of ruining what they already had.

So no, Ishan wasn't disgusted; he was scared. Scared of ruining their friendship, scared of risking Shubman. Ishan was not a gambler, and if there was one thing that he would never gamble, it was Shubman. Ishan would choose death over having to lose Shubman. He had been so resolute in this resolve that he had overlooked the possibility of hurting Shubman unintentionally.

He had played dumb to all the love stares from Shubman, 'He had always looked at me like that; there is nothing different.' He told himself every time he caught Shubman staring. He had turned a deaf ear to all the teasings that Shubman got from their teammates. He had made fun of all the edited videos of him and Shubman online. Had laughed at the audacity of people to ship him with Shubman.

He blamed it on the weather when he felt hot after walking in on Shubman, who had just gotten out of a bath. 'It isn't like I haven't seen him half-naked before. Fuck the global warming.' He muttered under his breath after clumsily slamming the door shut. 'I have a heart issue; I am sure of it,' he thought after his heart beat a little too fast after that one eye contact with Shubman on the field.

During the last few weeks before the accident, Ishan was so immersed in avoiding his feelings and Shubman's feelings altogether that he hadn't noticed Shubman hurting just a bit more every time Ishan had refused an ice cream date, or a movie invitation, or something as simple as sitting with him at the dinner.

Ishan was so scared to hurt Shubman that he was hurting him trying to avoid the same. It had all led to that one fateful fight they had just before Shubman got into that accident. ""Shubman, can you pass this list to Rohit Bhai?"" Ishan said without looking up from his laptop. That is what he mostly did: kept himself busy and away from Shubman and his thoughts.

""Can you at least look at me when you ask me for something, or do you hate me so much that you can't even bear to look at my face?"" Shubman said, his voice cracking just a bit at the end. That slip had made Ishan look at him with confusion etched on his face. ""What?"" ""Do you hate me now?""

Shubman's resolve was at its end. He had waited for Ishan to come out of whatever he had been facing. To come to Shubman like he always did, but this has been too harsh for Shubman's heart. The more he tried waiting, the more it hurt him.  In the end, Shubman decided to confront Ishan.

""Why would I hate you, Shubman?"" The use of his full name didn't help Shubman's breaking heart. He took the paper from Ishan's grip and went away to do what he was asked. ""Shubman. Shubman, look at me."" Ishan called behind him, but Shubman was adamant about not showing him how weak he was for him.

The air was thick with something more than just summer heat — it was the weight of too many things left unsaid. Shubman stormed down the steps of the stadium, jaw clenched, vision swimming, heart in his throat.

""Shubman, wait—!"" Ishan called out, voice cracking as he stumbled after him. But Shubman didn't stop. He couldn't. Not after the way Ishan had been treating him lately — like a stranger. Like he didn't matter. Like none of what they'd shared ever happened.

His nails dug into his palms as he walked faster, trying to outrun the lump rising in his throat. The blur in his eyes had nothing to do with the humidity. ""I'm talking to you, dammit!"" Ishan shouted behind him, feet pounding against the pavement. Shubman didn't turn around.

""You don't get to act like I'm the problem when you're the one who's been shutting me out!"" Ishan's breath hitched. ""I was trying to protect you—!"" ""By hurting me?!"" That was the first time Shubman's voice cracked, and it made Ishan freeze for a second. It was trembling and loud and thick with emotion.

Shubman didn't stop walking. ""You think you're protecting me? By pretending I don't matter anymore? By looking through me like I'm nothing? God, Ishan. You're not protecting me. You're just... you're just breaking me."" ""Shubman, please,"" Ishan tried, picking up pace again. ""I didn't mean to— I thought if I stayed away, it'd be easier—""

""For who?"" Shubman shouted, whirling around now as he crossed the road, walking backward to face him. ""Because it wasn't easier for me, Ishan! Not even for a second!"" Ishan finally stepped into the road, distracted, focused only on him.

And in that awful second, Shubman's smile dropped. His pupils dilated. His voice came out in a panic-stricken scream. ""ISHAN—!"" Ishan barely had time to process it — the blur of headlights, the screech of brakes, the roar of a horn. Then shove. Cold wind. Screaming metal. Skin meeting pavement.

And silence. Time froze for a second.

Ishan blinked, dazed, looking around, trying to understand why the world tilted on its axis. Then his gaze dropped—and his heart left his body. ""Shubman?"" he whispered. Shubman was lying just a few feet away, motionless.

""SHUBMAN—""

Ishan shouted himself awake, yanked out of the memory that had been tormenting him for months. His hand was being held tightly—someone was there—but everything else was chaos. Voices swarmed around him, but he couldn't make out a single face. There was only darkness in front of him, thick and absolute. His eyes refused to open. Maybe he didn't want them to. Maybe he couldn't bear the thought of seeing Shubman lying there—still, fragile—all because he'd chosen to be an idiot.

There was bile rising in his throat. He wanted to cry, but even his tears had betrayed him. Breathing felt impossible. It was like the oxygen had been punched out of his system like grief had made a home in his lungs. He tried reaching out to the fleeting figures in the dark, desperate to find something to anchor him.

""Ishan, inhale."" He followed the voice like it was gospel. He inhaled. ""Exhale."" He exhaled. ""Inhale."" He obeyed. ""Exhale."" With every breath, the oxygen slowly began to kick in—making him dizzy but conscious. ""Look at me. Look at the torch.""

There was a faint light ahead, a soft beam slicing through the blackness. Ishan tried to focus on it. His eyes strained, struggling to adjust until a face finally began to come into view.

The light grew brighter than expected, and he instinctively squinted. A bottle was pressed into his hands. He took a sip, his throat dry and scratchy, and looked up again. Concern was etched into every line of the person's face. Then came a light slap on his cheek, more grounding than alarming.

Just as he opened his mouth to react, a sharp pain flared up in his arm. ""Ah—!"" ""You okay?"" ""What the fuck was that?"" he rasped, breathless from the jolt. Before anyone could answer—before he could get a sense of who was around him—he was pulled into a hug.

Not just any hug. A hug that felt like home. He melted into it instantly, eyes stinging, throat closing. He clung to Shubman like he'd fall apart if he let go. And maybe he would've.

His innocent, sweet Shubman. His Shubman, who had fallen in love with him again even after forgetting who he was. His Shubman, who never once blamed him, not even after the memories returned. His Shubman, who, instead of yelling or asking for answers, was holding him like he was the one who almost lost everything. His Shubman, who had every right to be furious, to shout, to shove—but chose to stay soft.

His Shubman.

The tears weren't part of the plan. But they came anyway, hot and relentless. To be honest, the Shubman part of Ishan's life had never really followed any plan. He had the vague awareness that people were around—some concerned, others teasing—but none of them mattered. Not right now.

Nothing mattered when he was being held so close. When Shubman's heartbeat thumped steady and warm against his ear. When his presence alone was enough to calm the quake inside him. When the moment—the one that had shattered Ishan to the core—had finally passed. When Shubman was alive, safe, and right here.

That truth alone lulled Ishan toward sleep. A kind of sleep he hadn't known in months. The kind without worry. Without pain. In the arms of the person who meant more to him than breath itself.

This hadn't been on Ishan's to-do list. Not because he didn't want it—he just never thought he was lucky enough to deserve it. But sometimes life gives you more than you think you're worth. And maybe that's the quiet, aching beauty of wanting.

Of yearning.

Of finally having."
22,Anchor,https://www.wattpad.com/1540397461-a-love-twice-told-ishman-shubish-anchor,"Fri, May 9, 2025",1092,87,9,"When Ishan woke from the blissful slumber, the first thing he noticed was someone's arm protectively draped over him. He was being held so close, it almost hurt—whether from the grip of the person holding him or the aching swell in his chest, he wasn't sure. Maybe it was the overwhelming urge to cry when he realized it was Shubman holding him.

Anchored. In place.

He wanted to look up—to see Shubman's peaceful face, to make sure he wasn't hallucinating. But he also wanted to stay right where he was, in Shubman's arms, forever. He lingered in that dilemma for a while until a voice broke the silence—a sweet, velvety voice that could convince him to commit the most horrendous crimes, and he'd do them all in a trance.

""For how long are you going to pretend to be asleep?"" Shubman asked with a soft chuckle. A chuckle that might've given Ishan a heart attack had his heart not already been somewhere else entirely. Ishan looked up, to see that stupidly perfect smile tugging at Shubman's lips. Abruptly, he sat up. ""You're dangerous for my heart, Shubi.""

Shubman thought that was utterly ridiculous—everyone knew exactly who was dangerous for whom—but he smiled anyway. ""You scared me. What happened earlier?"" he asked, resting his head on Ishan's shoulder. At that question, the memories hit Ishan like a hurricane.

""Shubman,"" his voice cracked. Ishan turned to face him, taking his hand in both of his own. ""Shubi..."" It was hard to speak. Shubman was looking at him like an obedient puppy, eyes soft and open, the eyes he loved so much. ""I'm so sorry,"" Ishan whispered. It was all too much.

""Shhh, baby... You don't have anything to be sorry for."" Shubman pulled him into another hug, and Ishan broke. Again. He was sobbing like he'd lost everything—and maybe he had. Maybe everything that was now finally within his grasp had once been so far out of reach, that it had broken him.

""No, Shubi. It was my fault. I shouldn't have pushed you away. I shouldn't have avoided the confrontation. I thought I was keeping you safe. I thought I was protecting our friendship. But—fuck—I don't know why I ever believed I could keep anything safe at all.""   ""Shh. Stop speaking nonsense, Ishu. You are my safe place. I feel safest when I'm with you. If you can't keep something safe, then no one can. Okay?""

""Look at you—still trying to cheer me up when I almost got you killed."" Ishan's body shivered at the word killed, and it shattered something inside Shubman. ""No, Ishan. Look at me."" His voice held a quiet command that Ishan couldn't disobey. He lifted his gaze.

""You are the love of my life. Do you understand that, Ishan Kishan? If I had the chance to go back and redo everything, I'd still choose to save you. Do you know why? Because I love you. I have always loved you. Even before I knew what love meant, you were the one I loved the most.""

""You avoided me because you were trying to protect us—what we had. You were doing the right thing in your own way. But let me tell you something: I could die for you, Ishu. But don't ever ask me to stay away from you. That would kill me more than death ever could."" Ishan placed a hand over Shubman's mouth then, trying to stop him from speaking any more about death.

""Let me finish."" Shubman gently moved Ishan's hand away. ""I was mad at you. Yes. But not because you owe me anything—not because you're obligated to talk to me. I was mad because you decided what was best for me without asking me. Because you, Ishan Kishan, decided that being away from me was the best thing for me.""

""That is the most brilliantly stupid thing in the world because even a stranger would know—you being away from me for even a second takes a year off my life.""

""You, pretty little human, are the bane of my existence. I'd rather learn to live without oxygen than try to live without you. And none of this—none of what happened—was your fault. I jumped in for you, and I would unapologetically do it a thousand times over. You breathing, you being happy—that's all I need. With me or without me.""

If Ishan was crying like a toddler throwing a tantrum, well—that was between him, Shubman, and the quiet safety of this hospital room. How had he been so lucky? How had he ever managed to deserve Shubman?

""Repeat after me: I—"" Ishan looked at him like he'd grown horns but still repeated. Because when had he ever denied Shubman anything? ""I."" ""Am. Not. Responsible."" ""I am not responsible."" Ishan echoed, voice already cracking. ""For your accident."" ""For your accident."" His voice nearly broke on the last word.

""You hear that? You are not responsible for anything that happened to me. You're not responsible for me being in love with you. You're not responsible for me being stupid. And you are definitely not responsible for my accident. Do you understand?"" Ishan could only nod. Because words—what even were they?

Meanwhile,

""Ishan looked awful, waking up earlier."" Siraj just put it out there in the universe because why was no one talking about the state at which Ishan had woken up screaming Shubman's name earlier? That shook him to his core, and looking at the others, they looked like this wasn't the most heart-wrenching thing they had witnessed today.

""Thank God that trauma is kicking him. He needed that awful waking up, to be honest."" Shahneel spoke, making everyone nod. ""Don't even remind me how Ishan had looked just after the accident. He looked lifeless like his life was on the line."" Hardik said, clutching his head. That memory of Ishan is haunting him.

""To be honest, his life WAS on the line,"" Shahneel said, stating the obvious.   Shubman's mother looked up from the tea she hadn't touched. ""He really thought he was responsible?"" Abhishek nodded slowly. ""Didn't say it out loud at first. But it was all over his face. You could see it in the way he flinched every time someone brought up the accident.""

""He looked like he was punishing himself just by breathing,"" added Pallavi. ""Like if he dared to smile, it would be some sort of betrayal."" There was a pause. The kind that stretches because everyone in it is trying not to cry again. ""He wouldn't even come near me,"" said Shahneel, voice soft. ""Every time I tried to talk to him, it was like he thought I was going to blame him. As if we could ever...""

""God, it hurt,"" said Shubman's father, shaking his head. ""It hurt watching that boy fall apart over and over again, thinking we'd hate him. That we'd blame him. As if we hadn't seen the way he'd been breaking from the moment it happened.""

""He never blamed Ishan,"" Shubman's mother said. ""Not even once. Not when we were waiting outside the OR. Not when the doctors were unsure. He kept whispering his name."" ""And Ishan probably thought he didn't deserve it."" She wiped her eyes. ""All this time he carried that weight alone. That kind of guilt eats you alive.""

""He needed someone to say it. Out loud. That it wasn't his fault."" ""He needed Shubman to say it,"" Pallavi added. ""No one else would have mattered."" Another beat of silence passed.

""I saw him today,"" said Hardik quietly. ""Right after, Shubman hugged him. His face... you could see the moment it cracked. The exact moment the guilt let go. Like he'd been underwater this whole time and someone finally pulled him up.""

Shubman's dad gave a small smile. ""He loves him."" ""They love each other,"" his mother corrected gently. And this time, the silence in the room felt a little lighter. They all were exceedingly aware of the turmoil that Ishan went through right after the accident. He had spent the majority of his days hanging around in the hospital.

He refused to meet or talk to anyone. They remembered how one of the doctors had to physically drag Ishan into the canteen and explicitly threaten him into eating something. He had been lifeless. They remembered how his mother had to cry actual tears before Ishan agreed to go on that tour with the team.

They remembered how no one batted an eye or blamed Ishan even for a second when he ran right off the field onto the plane when he got informed about Shubman waking up. ""We tried to keep the information of Shubman waking up from him for as long as possible. Stupid me slipped it up. He just left everything important behind for Shubman, didn't he?"" Shahneel said, chuckling.

""He left everything not so important behind for a very important Shubman."" Ishan's mother added, looking at Shahneel with a small smile. They had all silently agreed upon their underlying love for each other. Never commenting on the obvious. They wanted their children to be happy and very much together.

""I remember the day we were checking Shubman out. It was the 18th of July,"" Shahneel said, her voice a little steadier now like the memory was wrapped in gold. ""Someone mentioned the date, and Shubman—he turned so fast like his body knew before his brain caught up. He said, 'There's something special on the 18th, isn't there?' I had goosebumps. Not kidding. He'd forgotten almost everything but somehow remembered there was something about that day.""

Shubman's mom let out a small, teary laugh. ""That boy and his 18th of July. You'd think it was a national holiday."" ""It was to him,"" Ishan's mother added. ""We all remember the way he used to light up when the date came close. He'd start planning two weeks in advance."" ""Because it was Ishan's birthday,"" Pallavi said, almost reverently.

""And he remembered it,"" Shahneel whispered. ""Even through everything, even when he couldn't recall his own passwords—he remembered Ishan.""

Everyone went quiet again. But it wasn't the uncomfortable kind of silence. It was full. Like hearts had just collectively sighed in relief. Like the ache had stretched itself and made space for something softer. They all sat with that for a moment.

""I walked in this morning,"" Ishan's mother added after a while, ""and saw the two of them curled up in that tiny hospital bed. Shubman holding him like his life depended on it, and Ishan sleeping like he hadn't in weeks. Like someone had finally taken the weight off his chest.""

""Someone had,"" said Shubman's mom, her voice warm. ""Love did."" Virat stretched his legs and groaned. ""God, I feel like I've aged ten years watching these two self-destruct and rebuild like it's their favorite hobby."" ""I'm just glad they chose love over fear,"" Pallavi said. ""And over guilt. That's harder than it sounds.""

And they all sat there in comfortable silence. Basking in the knowledge that these two idiots had finally grown some brains. That they had finally accepted the obvious."
