Order,Title,URL,Published_Date,Reads,Votes,Comments,Chapter_Text
1,A World Forgotten,https://www.wattpad.com/1475850793-a-love-twice-told-ishman-shubish-a-world-forgotten,"Thu, Sep 12, 2024",3744,156,32,"Third Person's POV:

Shubman Gill, a renowned cricketer, woke up in a hospital bed after suffering an injury, details of which were unknown to everyone. His family and friends were by his side throughout the tough times. A team of elite doctors was there to treat him and get him back in cricket, and although he was out of danger, he didn't wake up until now, weeks after the incident.

When Shubman woke up, he found his surroundings to be strange. The first person he saw was his elder sister, Shahneel. The white walls of the hospital made his vision blurry, and when he tried to speak, his voice betrayed him. It was as if he had forgotten how to speak. The strong smell of medicine and cleaning solution overwhelmed him, and he fell back into the bed with a thud.

This caught Shahneel's attention, and she quickly came over to her brother, holding his hand and pressing the call button with her other hand. Two minutes later, a team of nurses entered the room with concerned expressions, but they visibly relaxed when they saw Shubman looking around with his eyes wide open. ""Di, what happened?"" he innocently asked Shahneel.

""You got yourself into an accident, Shubi. But don't worry, you will be alright to play again in a few months."" ""But I have practice sessions; the coach won't take me to the upcoming tournament if I miss those."" He said, confusing Shahneel quite a bit. ""No..there is just IPL coming up, and I am sure until the end of IPL you will be alright again. I think you can miss one IPL Shubi."" Shahneel said sweetly, but her words had left a visible frown on Shubman's forehead. He looked at his sister like she had grown a second head.

""Why would you say that? What IPL?"" he asked, confused. Shahneel didn't understand the depth of the situation and left it for the doctors to let her know the reason behind her brother talking nonsense again.

Later, when the doctor came in for an examination, Shahneel brought up the incident from the morning, making the doctor frown too. He had immediately written Shubman a few tests and was waiting for the reports to arrive. ""Is it concerning?"" Shahneel asked. ""I think there might have been some problems with his memory, but since he remembers you, I don't understand the severity of this memory loss."" ""WHAT?""

A memory loss, Shahneel thought, would make quite an impact on Shubman's career because how the fuck would he play like that? But he does remember me, so it cannot be that bad, right? Her thoughts were cut short when the doctor called her in. ""Shubman, what is the last thing that you remember?"" The doctor asked Shubman; he frowned at the question and looked at his sister. ""Nothing. Can I go to the camp again, please?"" he asked them, making them both look at each other. Concerned.

""What camp?"" Shahneel asked, grabbing Shubman's attention. ""The cricketing camp di. Did you forget?"" ""Shubi, what year is it?"" Shahneel asked him, sensing trouble. ""2014?"" he answered, shocking both the people present in the room. ""No shubi, it is 2024."" ""WHAT?""

After the incident, the doctor suggested that Shubman should meet people he might not have met until 2014 and bond with them. According to him, this could help bring back his memory. The doctor assured that it was not a permanent memory loss, so there was nothing to worry about. He explained that it could be due to adrenaline blocking certain memories to focus on survival, or it could be due to concussion from the accident, but either way, there was nothing too permanent to worry about.

The doctor also advised that the details of the accident were not to be discussed in front of Shubman too early, before his brain was ready to process them. The next day, his mother and father, who had been in town while Shubman was admitted, came in to meet him. The nurses all treated Shubman like he was some celebrity, and he couldn't process that information. He tried asking his sister about it, but she didn't give him any details at all.

""He hasn't come in for a while now? Did they inform him about Shubman's improvement?"" He overheard the nurses outside his door talking about someone he had no idea about. This all seemed very strange to Shubman.

It took him quite some time to process the change in his body after waking up. He didn't remember becoming this muscular or his facial features changing so much. To him, it felt like it was just yesterday that he was about 14 or 15 years old. A ten-year jump in time was a lot to take in.

He watched some videos of himself performing online and couldn't believe that he was playing with people he could only dream about playing with a few years ago. This new information made him very happy, but he couldn't shake the feeling of missing out on something. He felt the need to meet someone, but he didn't know who this someone was.

The days passed by in a blur, and suddenly a week had gone by since he had woken up. His family had decided to keep this information a secret and only inform people about his awakening after returning home. This was a precaution to avoid any potential stalkers or paparazzi. Even people from cricket and Shubman's closest friends were not informed about his waking up.

""Ishan? Shouldn't we tell him?"" Shahneel asked her father one evening. He looked at her, shocked. ""You didn't tell him? I thought that you did."" ""No, you said that you didn't want anyone to know just yet."" ""Well, stupid girl, that obviously didn't include Ishan."" Shubman looked at his father with raised eyebrows. He had no idea who they were talking about or why he was so special, but he figured out that he must have been someone important.

""Why didn't he come in these past few days though?"" His father asked Shahneel. ""Well, he came in just a day before Shubman woke up, and he was supposed to be going in for some tour after that; he refused obviously, but I forced him to go. I didn't want to tell him also because then he would just return in the middle of it all."" ""Right. So, on second thought, let him just complete his work. Don't tell him."" ""Alright then, I will go inform Pallavi Di about it,"" Shahneel said and left the room.

Her father left behind her to get some medicines from the pharmacy, leaving behind a very confused and concerned Shubman. He tried to pressure his brain and think about any Ishan that he might be close enough to for his family to be talking about like that, but he seemed to have recalled no one as such. He gave up thinking after some time.

After that encounter, the Ishan guy was not mentioned again in front of Shubman, and he didn't think about the incident anymore either. It had been a little over a week since Shubman had woken up, and he was ruled fit enough to continue his physiotherapy in the comfort of his home. And so, he was discharged from the hospital.

The watchful gaze of people didn't bother him as much as it used to, and he was now preparing himself to enter a world that had nothing to do with the Shubman he had woken up as. Thinking about the difficulties that he might have to face in the future churned his stomach, but looking at his family, he thought that no matter how much time it would take, everything would eventually be alright again.

While his family was standing at the reception, completing the formalities for the discharge, Shubman was busy thinking about things again. He was brought back to the reality of everything when someone mentioned the date today. ""It is 18th July, isn't it?"" he heard and immediately looked in the direction.

This sudden move of his seemed to have alerted his family, and they looked at him concerned. ""What is wrong, Shubi?"" his mother asked in that sweet tone of hers. ""18th July?"" Shubman asked her. She frowned, but then she seemed to have remembered something and immediately looked at her husband. Shahneel was also looking at Shubman with wide eyes.

""Do you remember something?"" she asked him, looking hopeful, ""No. It's just that. Isn't it some special day? There is something today, right?"" ""You think there is something special on 18th July?"" Shahneel asked him softly, as if she were speaking to a toddler. ""There isn't?"" Shubman asked, feeling embarrassed, but he could have sworn that there was something special today.

Although he didn't know what it was, he knew that it wasn't a day to be forgotten easily; it was as if the date was printed at the back of his brain and initiated instant reactions from him. Shahneel was still looking at him with soft eyes that he didn't know the meaning of. ""Why?"" he asked his sister, but she just smiled in return and said, ""It is actually someone's birthday, Shubi. Someone that you know.""

He tried asking her about who this person was and why his birthday was so important that he remembered it even after he had forgotten almost everything else. He also thought about the possibility that it wasn't special because it was someone's birthday, but maybe there was something else entirely. But his heart was firm with the truth that his sister provided but refused to elaborate on. Every time he tried asking her about it, she would just smile and shake her head.

It was all too new for Shubman, and he still hadn't entered his forgotten world yet. It would be a long journey, he thought."
2,Do I Know Him?,https://www.wattpad.com/1476672299-a-love-twice-told-ishman-shubish-do-i-know-him,"Sat, Sep 14, 2024",2103,148,24,"Today Shubman's family was all busy trying to convince someone not to go somewhere, leaving something behind, and Shubman was very confused. He tried asking about it, but they were all too busy. After the nth attempt, Shubman gave up and returned to the confines of his room, where he sat and thought about life again.

Shubman had no work these days. He ate, slept, watched something, and slept again. That was all he did, with a bit of physiotherapy and a hell lot of medicine, of course. Some people came in to meet him every day. He knew most of them. The people that he had forgotten about were all busy with something and couldn't make it to him at the moment. Something told him that today he will be meeting one of them. Would it be Virat Kohli? There was anticipation in his heart; he was a mere fan after all.

What wouldn't he have given to be playing for Team India all those years back? This was him living his dream, and he was proud of himself for it. But when he thought about it some more, he realized that this memory loss thing could scar his cricket career permanently, and that thought was scary; it was more frightening to the 15-year-old shubman inside of him. So, Shubman was trying his best to regain his memories, but every time he tried remembering something, it would trigger a non-existent migraine in his head, and he would be discouraged to continue.

Shubman was battling another episode of migraines when he heard a commotion at the entrance of his house. Curious, he stood up and walked downstairs. As he descended halfway, he noticed a man standing at the gate, looking concerned. Surrounded by Shubman's family members, the man seemed to be searching for someone.

Their eyes met, and Shubman felt a spark of recognition. Although he didn't know who the man was or why he was there, he had a strange sense of familiarity. As Shubman descended the stairs, the man broke free from the crowd and hurried towards him, pulling him into a warm but urgent hug. Shubman was stunned.

Although he didn't know who this man was, the hug made him feel secure, like he had finally found something he was desperately looking for, something that had been lost for some time now. The man broke free from the hug and looked down, embarrassed. ""Sorry, are you okay, Shubi?"" he asked him, and he realized that they were on a nickname basis. ""Shubi?"" Shubman repeated dumbly.

""Ishan, we wanted to tell you something, but you wouldn't listen."" Shahneel started, and Shubman looked at her, trying to figure out the words that would be coming out of her mouth next. Shubman was thrilled to know that this pretty man was the Ishan everyone was talking about. Ishan looked at Shahneel too, waiting for her to continue. Even from a distance, Shubman could feel Ishan's heart racing. He was nervous.

""Shubman has lost his memories."" Shahneel gave the jab at one go and waited for her words to sink in. ""what?"" Ishan looked baffled, like he had anticipated everything in the world but this. He looked around, trying to figure something out. ""Shubman doesn't remember anything that happened in the past ten years. The last thing he remembers is from when he was 14 or 15."" Shubman's mother said, trying to help Ishan. ""You don't remember me?"" He asked, looking at Shubman, and the look he received proved that Shubman actually didn't have any recollection of him at all.

Ishan was then brought into the living room, where he was fed like a toddler. Ishan refused to eat much, saying that he had an upset stomach, but Shubman's family knew better than that. Shubman got wind of one thing: Ishan was a cricketer too. His family had informed Ishan about Shubman waking up in the middle of one of his tournaments, and Ishan had hurried here, ditching everything else. This was what the commotion was about. Shahneel had given Ishan an earful about how he shouldn't have done that and how that was the reason they didn't want him to know about it even earlier.

Ishan took it all quite sportingly. He had blended in with them like it was the most natural thing in the world, and Shubman was left in awe. His mother, he realized, had called Ishan ""son"" for the fifth time in a row, and the irony of it all was that if an outsider were to be added to this picture, he wouldn't say that Ishan didn't belong in this family. Shubman was left too stunned by it all.

Shaheel passed Shubman a smirk when she caught him staring at Ishan; the meaning of that smirk was beyond Shubman's understanding, so he remained quiet. Ishan gave Shubman a small smile and asked him if he was okay for the second time this evening. This time Shubman decided to answer him. ""Yes, I am very well; thank you."" ""Goddd shubman, I know that you don't remember me, but please, for the love of everything precious, don't be formal with me.""

Shubman just smiled at that. He could feel Ishan cringing at his formal tone. They might have been really close, he realized. ""How old are you?"" Shubman asked out of nowhere, stunning everyone present at the table. ""a year older than you."" Shahneel decided to answer instead. Shubman just nodded at that.

When his family was talking about Ishan back at the hospital, he thought that he might be someone important to them, but looking at their bond now, this was way beyond just being important to them. Ishan even knew all of Shubman's house-helps by their first names, and everybody seemed to adore him. Ishan had brought in a wave of happiness and hope with him, and although Shubman didn't recognize him, the fact that he had someone like him in his life warmed his heart.

After that encounter with Ishan, Shubman had stormed his brain for any possible explanation for the pull he felt with him. Shubman had realized that he definitely knew him from somewhere and that he was important to him, but where did he know him from? How had they met? All of these questions had helped catalyze his migraine, but he refused to just give up.

Shubman had heard that voice before; he had seen that face before, from where, he had no idea. Shubman had decided to finally give his paining head a bit of rest and go ask Shahneel about Ishan. He had imagined certain answers or even a lack of response from his sister; what he hadn't anticipated though was that brilliant smile that his sister passed him when he mentioned Ishan's name.

She smiled at him like she was waiting for him to approach her, like she had just won a bet against someone. That smile scarred Shubman more than it comforted him. ""What?"" she smiled again. ""You want to know about Ishan, Shubi?"" She said it in that vomit-inducing sweet tone that Shubman absolutely hated. Anything that followed that tone was always a disaster.

Shubman gave Shahneel an unimpressed look and proceeded to leave her room. Shahneel, on the other hand, caught Shubman's forearm and dragged him inside again. ""Alright, alright, no more teasing."" She continued when they had both settled on her bed. ""Ishan, his name is Ishan; that should turn some gears in your head shubman, and if it doesn't, then I am very concerned. He was your best friend."" ""Is."" Shubman interrupted her before she could continue.

Shahneel looked at him with curious eyes but decided to continue nonetheless. ""yeah, is. He is your best friend. He was the one we were most afraid of telling about you. He had been stuck in the hospital since the day you were first admitted and absolutely refused to go on that tour of his. I had to drag his ass out of the hospital and into an Uber. It just slipped up by my stupid mouth during one of our phone calls, that you had woken up. And that madman took a flight here.""

Shubman just smiled at her. Listening to her, Shubman felt like it was something that he would do. ""I just told him that you woke up and he cancelled my call and rushed here; I couldn't even tell him that you had lost your memories."" She continued. ""You'll seemed quite close with him,"" Shubman said, searching her eyes for answers.

""Well, his parents flew in to see you when you weren't even awake, so yeah, you can imagine your bond."" She answered, making him think about it. ""Oh, that reminds me, his parents would be here tomorrow. To meet you, of course. Although you don't remember them, please behave nicely."" She said it pointedly. Shubman gave her a look at that. Of course, he would behave properly. Even if Ishan weren't his best friend and practically a member of his family, he would still behave nicely in front of his parents. He wasn't that stupid.

""Okay, okay, don't give me that look. Also, why were you curious about him?"" ""Well, you would be curious too if you suddenly lost your memory and some stranger came into your home and warmed up with your family like his own, and you have no idea why."" He said it curtly, making Shahneel laugh in embarrassment. ""Sorry, Shubi, I can't imagine what you must be going through at the moment. But remember that we will always be here, okay?"" Sometimes Shubman liked his sister quite a lot.

He went to bed thinking about how and when he got to know this Ishan person and how they had become so close. He had this strong sense of familiarity with him, and his smile warmed his heart. With a single thought in his head, Shubman drifted off to sleep. 'Do I know him?'"
