Order,Title,URL,Published_Date,Reads,Votes,Comments,Chapter_Text
13,Lunch?,https://www.wattpad.com/1501646307-a-love-twice-told-ishman-shubish-lunch,"Mon, Dec 9, 2024",1613,133,23,"""Can you stop staring at me?"" Ishan asked again, still avoiding eye contact with Shubman. ""No,"" came Shubman's response, loud and clear, with no hint of hesitation. The answer stunned Ishan, making him turn to look at Shubman. ""What?"" Ishan replied, puzzled. ""What? You asked me if I could stop staring, and I just answered you,"" Shubman said calmly. ""What's wrong with you?"" Ishan questioned.

""Nothing at all. I'm doing very well, actually,"" Shubman replied with a smirk. ""Stop looking at me,"" Ishan insisted. ""Why? Does it make you feel things?"" Shubman teased. ""What?"" Ishan exclaimed, taken aback by the unexpected remark. He was shocked and momentarily speechless.

Shubman shook his head and laughed at Ishan's confused state, clearly enjoying the moment. ""It definitely makes him feel things,"" Rishabh chimed in, letting out a throaty laugh as he gave Shubman a high five.

""This is bullying,"" Ishan said, feeling utterly defeated. ""But it's just love,"" Virat added from behind him, and Ishan realized that nobody was on his side at that moment. Later, after the mock match ended and they had won, the team returned to their hotel to relax and prepare for the actual tournament.

Once back, Ishan went straight to his room. After sitting on the bed, he decided to watch something and maybe scroll through some reels before freshening up. So, he opened the app he deemed cursed—Instagram. He had named it that because there always seemed to be something unpleasant popping up on it.

As he scrolled, he came across a reel of him and Shubman in the dugout from earlier that day, and he cursed under his breath. 'Not this again. How fast do these people work?' he wondered, continuing to scroll.

Then he saw a reel of himself hugging Shubman after he had nearly scored a century. Now that he thought about it, he regretted hugging him so suddenly; he had just been unable to bear Shubman's sad expression without trying to do something to cheer him up.

Shubman had always been this way; he appeared to be a laid-back guy, but up close, he could be frustrating. He had a tendency to blame every failure on himself and linger in his guilt indefinitely, which Ishan found exasperating. He hated it when Shubman would retreat into a cocoon of self-loathing and refuse to accept help from anyone.

When asked how he was doing, Shubman always replied with, ""I am okay."" Deep down, Ishan wished he would admit that he wasn't okay and that everything wasn't fine. Ishan had always been the type to overlook when someone wronged him, preferring to let things go. In contrast, Shubman continuously urged him to stand up for himself and retaliate against insults.

When it came to being loose-mouthed and foolish, Shubman was number one. However, when it came to his feelings, he often acted like an idiot. Rather than accepting that he wasn't okay, he would gaslight himself into believing he was fine, and Ishan always noticed. He could tell when Shubman was plunging into those episodes of self-loathing; it had become second nature for him to see it.

During those times, his instinct was to sit beside Shubman. He wouldn't say a word, just be there to let him know that he was present—that he would always be there for him. Ishan wanted Shubman to understand that no matter how badly he might mess up, he wasn't going anywhere.

Looking back, Ishaan realized he had always sensed that Shubman felt more than just friendship; perhaps he had been in denial about it. Regardless, that was all in the past now, and he preferred not to dwell on it.

Nevertheless, he often found himself thinking about those feelings. There was no way he could have missed them; everyone else seemed to know as well. Ishan found himself reflecting on how Shubman might have felt all along, grappling with so many hidden emotions.

Did he feel sadness? Was he overthinking? Ishan was certain that he didn't love Shubman in any way other than as a friend, yet when he looked at him, it stirred something deep in his heart. He had always been aware that Shubman liked to gaze at him; it was almost a habit, but he had never inquired about the reason behind it.

Now that he understood, he couldn't stop his mind from wandering or his heart from racing under the intensity of those stares. He couldn't help but wonder when and how Shubman's feelings for him had begun, and most importantly, why him. Out of all the people, why did Shubman choose him?

Shubman could easily attract anyone, and that was no exaggeration. Ishan had always been vocal about how handsome he thought Shubman was— because he truly was. Handsome, charming, and a millionaire cricketer, what more could someone want? He could have had anyone, so why Ishan? These thoughts had consumed Ishan ever since Shubman's confession. Did Shubman always like men?

'But I would've known if he had. He would've told me, right? Was he scared that I would judge him?' That thought frightened Ishan. He didn't want to imagine a scenario where Shubman felt he might be judged by him. He would never do that—at least not in this lifetime. Ishan thought he had made it clear to Shubman how he felt, but alas, one can never fully understand another's feelings.

As he looked at the video again, he noticed how Shubman physically relaxed during that hug. He could see the relief on Shubman's face when he told him he was proud of him. Ishan wanted to see that smile forever; he wanted to hold on to that memory and never let it go.

Lost in these thoughts, Ishan involuntarily smiled. ""What got you smiling like that?"" he heard. Startled awake from his daydream, Ishan jumped a little. Later, when he analysed the moment, he realized that Shubman had just walked into the room and caught him off guard.

Trying to cover up, he said, ""Nothing. Just talking to Aditi."" And he slapped himself internally. ""Who?"" Shubman looked and sounded very upset at the mention of her, and Ishan felt like teasing him a bit more. ""Aditi? You don't know her? Oh right, your memories... She is a 'close' friend that I met at a party a few months back. I enjoy her company quite a lot.""

""Righttt, Aditi. I don't care who she is at all, Ishan, but remember that I am the one courting you right now."" Ishan, after seeing that sad look on Shubman's face after the mention of Aditi, didn't expect this answer at all.

""what?"" ""What?"" Shubman repeated. ""I never agreed on your courting or whatever."" ""I make the rules, baby. Come on, get ready; we are going out for lunch."" It wasn't the first time Shubman was using that endearment, but it was mostly used by Ishan before.

After the confession, though, that word had a completely different meaning now, and Ishan was too embarrassed at it. ""we are not going anywhere."" ""Yes, we are. We are going on lunch, so please get ready.""

After a lot of arguments, Ishan finally gave in and begrudgingly got up to go get ready. Shubman smiled in victory. When both of them were ready to leave, they went downstairs. And the most irritating part of Ishan's day started. The hootings. ""Ohoooo, is Ishi going somewhere?"" Hardik was the first to notice them.

Ishan just glared at him and then started glaring at Shubman. ""What did I do?"" He defended himself, acting too innocent for Ishan's liking. ""Bhai, Shubman se nazar hate toh kahi aur bhi dekh lena."" Rishabh joined the drama. ""Tum sab jao bhaad main main kahi nahi jara ab.""

With that, Ishan turned around to go back to his room but was pulled into a hug by Shubman. ""A commitment is a commitment, baby; you cannot back off now,"" he whispered in his ear, loud enough for the crowd to hoot in return. And Ishan was left embarrassed yet again. Shubman took Ishan's hand and dragged him out of the hooting crowd and into the car.

The ride to the destination was silent, and nobody spoke anything, letting the calmness elope them in a thin bubble of serenity. Neither of them wanted to break this silenced calmness. They sat there enjoying the night and each other's company. After a while, Shubman stopped the car and motioned for Ishan to get out.

Shubman went to park the car and came back with the biggest smile on his face. ""what?"" Ishan asked, ""Nothing, just happy to be here with you."" And Ishan would die with the fact that he melted a bit at that. They went inside the restaurant and took a seat at the far corner.

""Did you book it in advance?"" Ishan asked Shubman. ""yes."" Shubman replied with sparkling eyes. There weren't many people in the restaurant; perhaps it was more famous for dinner, Ishan thought. After a minute or two the waitress came in to take the order. ""he will order."" Shubman pointed towards Ishan.

Ishan left confused, took the menu under pressure, and ordered a few things. ""Why the sudden lunch plan?"" ""Because I am courting you?"" ""What nonsense, Shubman."" ""Okay, I want to know more about you. Tell me, do you like tea or coffee?""

Ishan, after witnessing that this man was not in the mood to give up at all, decided to play along. ""It took you years to know me as well as you did. Now you need another couple of years to know me better. You cannot just ask me about it; Shubi, do some hard work and research.""

Shubman just smiled at it. ""Now you are talking."" And Ishan just laughed at it. He realized that after all, this was his best friend, Shubman. There was nothing in the world that could keep him from talking to him or indulging in his stupidity."
14,She likes you.,https://www.wattpad.com/1512137540-a-love-twice-told-ishman-shubish-she-likes-you,"Tue, Jan 21, 2025",1460,118,25,"""Do you like shrimps?"" Shubman asked when he saw Ishan enjoying the shrimps that he had ordered, a bit too much. ""I love seafood."" The statement was as plain as it could be, but it still tugged something at Shubman's heart.

Earlier, when he had looked at the menu and had asked Ishan to order, he had been prepared for a lot of seafood on the table for some reason. He felt happy to know that his instincts still remembered Ishan so well. He knew that Ishan liked seafood well enough for him to order it.

""Earth to Shubman."" He came back to reality when he heard the voice that was so close to his heart. He smiled at Ishan, and his heart skipped a beat when he smiled back at him. His heart was skipping a bit too many beats these days. It might be very unhealthy, but is Shubman considering being healthy right now? No. No, he wasn't. Ishan has taken all the space in his mind, and Shubman doesn't think about anything that isn't Ishan these days.

The lunch was as simple as it could get. There was nothing too fancy about it, but for Shubman it was better than anything else he had experienced. He loved every minute of this setting. Ishan and he had talked a lot more than they usually did. Ishan seemed relaxed; nothing about him suggested that he was uncomfortable.

Shubman at first was unwilling to ask him out on a date. He felt like it could be the reason Ishan would finally snap at him, but being here like this, Shubman felt like even dying would have been worth the try. He wanted to be here in this moment forever. Listen to Ishan Yap forever.

It was so weird because Shubman was so lost in Ishan's eyes that he could barely hear anything from around him, but somehow he heard and understood every word that Ishan was speaking. It was scary, but did Shubman care? No, he didn't.

""What is it?"" Ishan asked out of nowhere. ""What?"" stunned, Shubman asked. ""I know you want to ask something, so just do it. Tell me what is bothering you."" Now that Shubman thought about it, that was very true. He did have something to ask indeed. How Ishan knew about it was a topic that Shubman would discuss with himself later, but for now, he needed to organize his terrain of thoughts and sort out an answer to Ishan's question.

""Well, the thing is... I thought that maybe this lunch would be awkward, you know. You didn't want to come, but I forced you anyway. I was prepared for the silent treatment and quiet awkwardness. But this, this is anything but that. It feels a bit too natural.""

That was true. Shubman had made up his mind for the complete opposite of what was going on here. He didn't expect the conversations to be as smooth as they were now, and he absolutely didn't expect Ishan to be this easygoing here. He thought that Ishan would be a bit stubborn and unsettling.

""Well, it feels natural because it is. You might not remember it, but we used to come out like this all the time. 'Friendly dates' you called it."" Ishan smiled at the memory, and Shubman's heart did another somersault. ""Yeah, I am sure they were friendly."" This comment of Shubman's made Ishan look up at him. There was something in his eyes that Shubman couldn't just understand.

""Well, I don't know about that, but they were the best part of my days. Shubman, I don't care about whatever. I don't care if they were just friendly for you or not; nothing would change the fact that I have spent the majority of my life in your company, and trust me when I say it: I enjoyed every minute of it.""

All the overthinking that Ishan had done earlier at the hotel was playing with his mind. He couldn't just let things be and make Shubman believe that he didn't care about him. He couldn't fathom the fact that Shubman thought this lunch would be awkward. Ishan had never felt awkward with Shubman, and he never will. And he was on a mission to make Shubman understand that.

""Shubman, I love spending time with you. I love every second of our conversations. Look, I don't care how you think your feelings are for me. But to me, you will always be special. It doesn't have to be in a romantic way, you know."" ""I know."" Was the only thing Shubman could say before the calm silence enveloped them again.

When they reached the hotel a few hours later, the team was still loitering around in the lobby. They received the eyes when they entered, and Ishan was done with all of them at this point. ""what?"" he asked. ""You seem to enjoy using that word a bit too much these days,"" Rishabh replied, looking up from his laptop. ""Oh. Shubi, Sara came to see you."" He continued before Ishan could get back at him.

Hearing that Sara came to see him, Shubman was confused for a second before asking, ""How was my relationship with her?"" ""You were close. She liked you."" Ishan said, looking straight at Shubman, that stare made Shubman increasingly aware of Ishan's intentions to set him up with her, and it made him sad beyond measure.

""so?"" Shubman deadpanned. ""Nothing. I was just saying."" Ishan shrugged under Shubman's scrutinizing gaze. Later when Ishan looked up, he realized that everyone was looking at him with disappointment in their eyes. ""What is wrong with you? She liked him, and I just told him about it because he asked."" He left the room with that.

""Does he want me to end up with her, or does he just want me to not like him anymore?"" ""Neither. He is just an idiot."" Yashasvi replied without even blinking, and everybody agreed with him. ""You should talk to Sara, though."" And Shubman agreed to talk to her. He would meet her tomorrow.

Ishan in the room weighed a lot of emotions in his heart. So much that he couldn't pinpoint any of them. He just lay down on the bed and drifted off to sleep without even realizing it.

Ishan woke up the next day with an empty bed. There was no sign of Shubman in the room, the bathroom, or the balcony. Ishan shouldn't have been as stressed about his sudden disappearance as he was. But that was a concern for the future Ishan. So, he did the right thing. He freshened up and went downstairs to ask about him to the team.

""Where is Shubman?"" ""Did he not tell you before leaving?"" ""I didn't meet him last night at all. I slept before he came to the room and just woke up."" ""Right, he didn't have the chance to tell you."" ""Where is he?"" They exchanged a look that Ishan didn't know the meaning of before replying to him in a solemn voice, ""He went to meet Sara.""

""Suddenly?"" ""What's suddenly? She came to meet him twice already and couldn't find him, so yeah, it is only right that he meet her now, right?"" ""Right."" And Ishan left with that. His expressions were unreadable. ""Do you see something amiss?"" Rishabh asked Siraj with twinkling eyes.

""Not as much as I expected to see, but this is good too."" ""What do you mean, Miya? This is already too much. You expected too much from a dumb person like Ishan."" ""Well, that is also true."" And they shared a hearty laugh at that, completely unaware of Ishan and his turmoil.

""I came to see you yesterday, but you were out,"" Sara told Shubman. They were both sitting in a restaurant nearby. ""Yes, I was out with Ishan."" And with that, her expression changed. ""Look, you might know already that I have no memories whatsoever of the past ten years or so. I am so sorry, but I don't remember anything about you either."" ""I know. I mean, if you couldn't remember Ishan, how can anybody expect that you remember them?""

""What?"" Shubman was stunned at that sentence. Sara just laughed out loud. ""You seem to be confused. Do you really remember nothing? Well, Ishan is your best friend that you know of, right?"" ""Yeah, they told me."" ""So, you were with him all this time? How did you like him?"" ""He is an amazing person. I can completely see why he was my best friend."" ""Just that?"" Sara asked, confusing Shubman more. ""what else?""

""Nothing. Tell me, Shubman, what did they tell you about me?"" Shubman chuckled before replying. ""they said that you were my PR stunt."" And Sara laughed at that too. ""that is true."" ""and Ishan said that I should go on a date with you. I feel like he is trying his best to set me up with you for some reason.""

""He is an idiot."" She replied, making Shubman laugh once more. ""all the teammates said the same thing."" ""Because he is."" ""He said that you like me."" Shubman was a bit hesitant in saying that because he didn't know how Sara would react, but he didn't want to lead her on either; he just wanted to clear things up.

""Are we doing this again?"" ""Again?"" questioned Shubman. ""Well, I seem to remember a similar conversation between us. Let me guess: you want to tell me that I might be an amazing person and might as well be the most beautiful girl, but you cannot give me a chance; you, in fact, don't want to. All because you are in love with someone else and you cannot love anyone who is not him? So, you would rather not lead me on?""

Sara said all that with so much confidence that even Shubman thought that the conversation might as well be scripted. He was actually trying to say exactly that. ""Ho..w?"" Sara smiled at the stunned Shubman.

""You have already told me once, and yeah, I did like you back then, but not anymore. I am rooting for you and your undying love for Ishan."" Shubman was stunned even more. ""how'd you know?"" ""Do you think I am blind? You never really told me who this person is that you love, but trust me, it wasn't hard to guess at all.""

And Shubman just looked down, embarrassed. He hadn't been this embarrassed a day since he had woken up in that hospital bed. ""I am surprised that the person who calls himself your best friend couldn't guess it. or wait, maybe he isn't just dense and blind but is in denial."" ""I told him."" ""WHAT?"" She shouted so loud that the tables near them took a look at them.

""What?"" she asked again in a lowered voice. ""Did you confess to him?"" ""I didn't mean to; I just wanted to know if I always liked him, or was I falling after losing my memory, and it just slipped like that?"" ""What are you doing about it then?"" ""I am...um...courting him."" And Sara looked at him speechless. After a good 5 minutes of stunned silence, she started to laugh so hard that Shubman was concerned about her mental health for a second there.

""You are doing what? What is this, Shubman? 500 bc?"" ""Stop laughing like that, okay? Is it that wrong to try and court someone?"" ""Oh god, Shubman, stop using that word. Did Ishan not slap you when you told him that?"" ""He very much wanted to."" And they both shared a laugh at that."
