Order,Title,URL,Published_Date,Reads,Votes,Comments,Chapter_Text
7,Improvement,https://www.wattpad.com/1486562411-a-love-twice-told-ishman-shubish-improvement,"Mon, Oct 21, 2024",1747,136,39,"Shubman had recently started watching the cricket matches he had missed over the years. Coincidentally, all of the matches that he watched somehow had Ishan in them. He totally didn't search for those specific ones to watch at all.

Shubman had sat through the night, surfing through the early matches of Ishan's career. He was an impeccable player, Shubman realized. His playing style, stance, and everything on the whole were admirable. But Shubman wasn't just watching these matches for Ishan now, was he?

He was watching it to learn more about his co-players and to learn more about their cricketing careers. At least this is what he told his sister when she asked about this new hobby of his. She made a weird face but didn't question it any further. The doctors and physiotherapists had reduced their scheduled checkups from daily to every two days and now once a week.

Things were going brilliantly for Shubman, and everyone was quite happy with it. Ishan didn't visit Shubman as much as he used to because now there was an upcoming tournament that he had to practice for. He got busier with these practices as the days passed. But Ishan religiously called Shubman. Everyday.

No matter at what time, there wasn't a day that Ishan didn't call. Their conversations earlier limited to cricket and Shubman's health improvement were now open to mental health and personal lives also. Shubman realized that he loved talking to Ishan. Maybe a bit too much. To the point that he didn't miss any of his calls.

Shubman had stopped sleeping at weird times just so he wouldn't accidentally miss one of Ishan's calls. He knew that if he missed the call, it would be tough for Ishan to call him again; he was busy after all. And it warmed his heart to know that despite being so busy, Ishan never once forgot calling him.

Shubman in the times when he didn't have to do his routine exercises watched cricket matches and made notes. Don't get him wrong, he did watch other people play too, but he got this idea of watching the now-old matches because he wanted to see Ishan playing. So, he watched one match, then he watched two matches, and now it has given way to a series of matches watched and numerous players analyzed.

Now, Shubman had a brief knowledge of almost all the players on the team with him and a sea of knowledge about Ishan Kishan. Somebody can wake him up in the middle of the night and ask about the cricketing career of Ishan Kishan, and Shubman would still say it all correctly. It was all itching at the back of his brain; he didn't know that it was there. Now, after watching all these matches, these memories were unlocking themselves.

Sometimes he would search for some specific match because his conscious told him that it was an amazing match, and when watched, it would indeed be an amazing match. Sometimes, he would randomly remember some incident that didn't happen in the recent past of his broken memories and spend hours thinking more about that incident.

Shubman didn't dislike this outburst of random information at random times, but he wasn't a fan of it either, because then he would spend the majority of his time thinking about it, and it honestly gave him a headache almost always.

He told about it to his doctors of course, and they said that it was completely normal and asked Shubman to refrain from preying too much about the details of these scenarios. Sometimes, when done with all the thinking, he would ask about them to Ishan, and Ishan, like the good friend he was, almost always knew the details of these scenarios.

Shubman loved listening about his life from Ishan's point of view. He didn't know why, but he did like it. These conversations were fun when they lasted, but Shubman would feel the air shifting a bit at the end of all of these conversations, it wasn't like he didn't ask Ishan about it, but Ishan would just change the topic, and then they would resume talking like nothing happened.

This week couldn't be going any better for Shubman because he got a call from BCCI today asking him to join the upcoming tournament as a spectator. Shubman would travel with the team and stay with the team; he wouldn't play, of course. He wasn't fit enough to play yet, but he would get to be on the field watching them play and learning from them.

To Shubman, this was an amazing opportunity because this was a huge step in regaining his career in cricket. He was touched to hear that they were bothered enough to let him in. ""Try talking with all of them and try regaining your memories, Shubman; this is the best opportunity to do that."" Shahneel had told him after she heard about the news.

Shubman had nodded positive and went to sleep. They were to be deported to England for the tour the day after tomorrow, and Shubman was ecstatic, to say the least. The night before the flight, he couldn't sleep until late at night, but he woke up before his alarm and got out of bed to get ready.

His mother had packed his bag for him, and he felt he hadn't aged a day, making his heart go all mushy. The team bus was to come to pick him up, and he wasn't used to being spoilt like that, even if he was the younger child. So, he got up and got ready because he didn't want to spoil whatever reputation he might have made because he got late.

His sister teased him to no end, and Shubman remembered the day he had first gotten selected for a major tournament ten years ago, and his sister had the same reaction. He didn't need to have his memories to know her response every time he had something major going on. He smiled at her despite her teasing, because where else would he get a sister like her?

Shubman jumped up the bus the moment it got there. He was greeted by familiar faces, and he felt peaceful being around them. The crowd was cheering for him when he got on the bus and pulled him in for a hug. After the hug broke, someone dragged him to a seat. When he looked at who the person was, he was pleasantly (not so) surprised to see that it was Ishan.

He sat beside him, and no one batted an eye. They reached the airport, and Ishan sat there beside him, and then they boarded the plane, and Ishan sat there beside him too. As if it were the most normal thing to do. It came naturally to them. 'He is your best friend; of course, you'll stick together everywhere.' His mind supplied.

But nothing was helpful when Ishan dropped his head on Shubman's shoulder after he had dozed off. Shubman short-circuited. He had become so stiff that Rishabh, who was sitting just a seat ahead of him, took notice of it and started laughing until his head fell off. Luckily for Shubman, most of the members were sleeping, but those who were awake were tormenting him enough to last a lifetime.

After some time, he had relaxed, and soon he slept too. His sleep was half broken due to some commotion near their seat, and before he could open his eyes and see what was happening, there were suddenly hands placed on both of his ears, as if wanting to block off the noise. And it did work because now the background was all muffled.

But Ishan's voice came clear to Shubman as if speaking right next to his ear, ""Can you go do this somewhere else? Shubman is sleeping."" ""When he sleeps beside you, Ishan, even a nuclear bomb fails to wake him up."" Someone said, ""Oh, please, Rishabh, fuck off. I swear if he wakes up due to your stupidity, I will personally plant lizards in your luggage.""

""Do you think I am scared of that?"" ""You want me to prove my theory?"" and that seemed to have made Rishabh retreat. Shubman didn't want to smile physically because then Ishan would know that he wasn't sleeping, but he smiled internally before dozing off again.

The second time Shubman woke up was because someone shook his shoulders so hard that he thought that he would dislocate them if this continued for a minute more, so he decided to wake up. He realized that it was Hardik who was trying to wake him up. ""Finally, Shubman, I thought you were dead."" Shubman gave him a look and then decided to look out the window instead.

""Let's go; we are here. Or do you want to be ported somewhere else?"" Rishabh said, pulling him out of his seat. Shubman begrudgingly took his backpack and exited the plane with the team. The departure from the airport to the hotel took them an hour, and now they were all in the lobby of the hotel they had booked.

""Alright people, we have fewer rooms, so, two for one, come on, choose your roommates,"" Rohit said after they talked to the receptionist. ""Ishan and Shubman. Your keys."" Virat handed Ishan a key, and Shubman looked baffled at that. He looked like he wanted to ask something but decided against it.

""Why do you look like that? You always share rooms with him."" Rishabh said, looking at Shubman, which made a few other heads turn too. ""You wanted to stay with someone else, Shubi?"" Ishan asked him, and the ""no."" came out of him instantly. Rishabh, like the bitchhead he was, laughed at that. And when Shubman looked around, almost everyone was trying to control their smile.

""Come on, Shubman, you stay with him even if they had you allotted a separate room of your own. It's almost as if you are glued to him."" Virat said teasingly, and Shubman raised his eyebrows at that. ""Wait, you can share the room with me for a change. Ugh, Rohit bhai, why did you have to give them the keys so fast? We could have actually made Shubman stay away from Ishan. It would have been an opportunity of a lifetime, bhaiya.""

And everyone looked like they were all as regretful as Rishabh was. ""In your dreams, Rishabh Pant, now give us a side, please; I want to go to sleep. I don't have enough energy to spend on your nonsense."" Ishan said, pushing Rishabh to the side, grabbing Shubman's hand, and then proceeding to hunt for their room.

Everyone, including Rishabh, just looked at the retreating figure of Ishan with Shubman at his heels, with an adoring smile on their faces. ""Come on, decide your rooms."" Hardik clapped twice to gain the attention of the crowd before speaking. They all then went back to deciding rooms for themselves with a smile on their faces."
8,Jealous? Yes.,https://www.wattpad.com/1488861686-a-love-twice-told-ishman-shubish-jealous-yes,"Tue, Oct 29, 2024",2006,144,40,"Shubman, after reaching the room, sprawled on the bed instantly. ""At least change Shubman."" Ishan's said, who had just exited the washroom, hair still dripping wet and a towel in hand. ""I am sleepy."" Replied Shubman, who now faced the window on the other side of the room, opposite of where Ishan stood.

The wet hair and the clothes sticking to his body due to the moisture had Shubman's brain freeze. He tried his best to avoid looking at him and faced the other way. What Shubman couldn't understand was why Ishan had such an effect on him. Or maybe he had just completely lost his mind now.

The bed dipped at the foot, and Shubman instantly sprang up, took his clothes, and banged the washroom close. Ishan was left on the bed still with a towel, staring behind the now-closed washroom, thinking what the fuck was wrong with Shubman. It wasn't new for them to be sharing rooms, but this stupidity of Shubman was new for him indeed.

Ishan, like a good friend, waited for Shubman to get done so that both of them could rest a bit, but Shubman took his sweet time in the bathroom. After what felt like centuries, Shubman finally got out of the washroom with dripping hair and body-fitting clothes that seemed to be wet too.

""what....?"" Ishan started before realizing just what was wrong... ""You forgot to take the towel?"" asked a very stunned Ishan. ""Shubman, are you stupid? There was one inside too, if you just opened your eyes, Shubi, and you could have always asked me for one, you know."" Shubman looked very embarrassed at that. ""I didn't want to bother you.""

Ishan got up from where he was sitting on the bed and immediately put his palm against Shubman's forehead. ""Are you sick?"" ""No, I am okay."" Said Shubman, taking Ishan's hand off of his forehead. ""Dry your hair at least,"" Ishan said while grabbing a towel to dry Shubman's hair for him.

They were right in front of the mirror, and Shubman's eyes were fixated on Ishan's face. ""There is something you want to say?"" Ishan asked, meeting eyes with him. Shubman looked away, breaking the eye contact, and shook his head in negative. ""You sure you aren't sick?"" ""No, Ishan, I am fine; I just need sleep."" ""Right, it has been so long since you last travelled; it must be hard. Alright, I am almost done with your hair; you can sleep.""

Shubman got up from the chair and went to the bed to lie down, immediately closing his eyes. Ishan, on the other hand, switched the lights off, closed the curtains, and tucked the blanket over Shubman before lying beside him and dozing off, too.

Shubman didn't sleep a wink before it was time for them to get off to eat dinner. He just lay there awake until he got a message from Virat to come downstairs. He was tired—too tired to even lift a finger—but he just couldn't sleep. It hadn't happened to him before, and he couldn't figure out what was wrong. So, he decided to get up and freshen up before waking Ishan too and going to get the dinner.

""Ishan, the dinner is ready. Wake up."" Said Shubman, shaking Ishan a bit. He, on the other hand, just changed his position and continued sleeping again. ""ishaann."" He said it a bit louder this time. Ishan stirred a bit before opening his eyes to see Shubman too close to his face, so as a reflex, he kicked Shubman off the bed.

""What?"" Shubman was left on the floor speechless. ""I am so sorry, Shubi. I am up. Let's go."" He said helping Shubman up from the floor. ""You didn't have to kick me like that."" ""I am sorry, okay,"" Ishan said before going off to freshen up, leaving Shubman to his element once again.

Later, when they were both coming downstairs to eat with the team, Shubman instantly tensed up. There, sitting right beside Virat, was Meera. He couldn't wrap his head around why this girl would join them at their team dinner. He went towards the table and sat right across from her beside Rishabh, who was looking at him with mischievous eyes.

Ishan, who came down with him, was busy chatting with some staff members before he noticed that Shubman had already sat at the table, so he went there too. Meera, who saw Ishan coming towards the table, stood to grab a chair for him, but she was just halfway up when Ishan came and took a seat beside Shubman.

This didn't escape the eyes of anyone on the table, and they all gave each other a look before continuing what they were doing. Shubman, on the other hand, was shocked and speechless. He just kept looking at Ishan. ""Ishan, all the best for the match."" Meera finally said when the air was shifted to lively again. ""Thank you.... Oh hi Meera I didn't see you there. When did you get here?""

""Just came to cheer you up; Virat bhai insisted that I stay for dinner."" ""Of course, he did. You are like a sister to all of us, right, Ishan?"" Rishabh asked, and Shubman for the first time felt like he could say that he liked Rishabh. ""absolutely."" Ishan replied while serving himself and Shubman some food.

""Bhai? Isn't this too oily for Shubman?"" Ishan said, looking at Hardik, who was the one to order the food. ""Is Shubman a baby?"" Meera said, interrupting again. To her, it was a joke because she was smiling while she said it, but the tone with which she said it, wasn't friendly at all. It had bitterness in it.

She got looks from all across the table, but they all decided to ignore her. ""I mean, we have people younger than him on the team; why is he babied like that? He can eat the oil, you know. Won't die, trust me."" She smiled at Shubman while taking a bite of the food. Her words had hidden venom in them.

She sounded like she had been waiting to say all of this. Shubman was stunned speechless. He couldn't understand why he was the target of her biting words suddenly. To him, she didn't sound friendly at all, not even remotely. Shubman was still busy thinking about what he did wrong when he heard from beside him.

""Have you gone insane?"" Ishan's words were cold, and he never spoke like that to anyone. It shocked everyone on the table, not because someone was saying something like that but because was Ishan saying it. Rishabh, who was just about to reply to her nasty words, just looked at Ishan and smiled. ""I was just joking, Ishan."" Meera tried to reason with him, but he just scoffed at her before talking to the waiter.

Nobody dared to cut Ishan's words because this Ishan was scary. ""I am really sorry, Ishan. I didn't mean it like that."" ""You don't have to be sorry, Meera. I know what you meant and what you didn't, so I would suggest that you continue eating before I lose my cool."" This seemed to have pushed the wrong buttons because Meera instantly flipped.

""He can do anything, and nobody blinks an eye, and just when I say the truth, you start losing your cool, Ishan? just amazing.""  ""What in the world did he say to you?"" Hardik asked. He didn't like the way she spoke to Ishan at all. ""You don't know?"" Her words were mocking, and Shubman didn't like the fact that he didn't understand what he did wrong.

""Truth is Meera, you like Ishan, and he doesn't like you; that's it. You can just accept it and go home. There is no need to channel your anger on other people."" Rishabh's words seemed to have jabbed her in the right places. Because she looked like she just got stung. ""I don't stay where I am not respected."" With that, she just took her bag and left the hotel.

They were all quiet for some time, looking at each other. And then they all suddenly burst into laughter, ""What is wrong with you?"" Virat said while laughing. ""Your good friend's daughter just went away angry, bhai, what now?"" Ishan was too good sometimes. ""My good friend doesn't like her all that much either."" Rishabh was the one to laugh the loudest at that.

""Don't mind her too much; people do insane things when they are in love."" ""We know Yash; she isn't a bad person,"" Rohit replied to Yashasvi, smiling at him. ""I shouldn't have talked to her like that. She has always been sweet to me."" Ishan said he regretted his earlier outburst. ""Of course, she has Ishan; she likes you.""

""what? I just thought you were saying that to piss her off. Does she actually like me?"" ""Yeah, I mean, if it wasn't obvious enough, yes, she does."" Hardik finally lost his cool with Ishan and snapped at him. ""Why have I never noticed that?"" ""Because Ishan, you are blind when it comes to people who like you. So many people have a crush on you and you don't even know; you are the most oblivious person I know. Not even kidding.""

Rishabh sounded like he was done with Ishan and his antics now. Shubman was in his world while they were all busy fighting amongst themselves. He had a lot to think about. He knew that Meera liked Ishan, but what problem did she have with him? If they were just friends, then why would she target him of all people?

'Maybe he liked... No what nonsense.' Shubman was having a complete monologue with himself. He didn't like it when Ishan talked about Meera so softly; he didn't like the fact that he was regretful about snapping at her earlier. Was he jealous? But that was impossible, right?

Shubman was brought back from his turmoil when Rishabh elbowed him. ""What are you thinking about?"" ""Poor guy is stunned,"" Virat added helpfully. ""You didn't have to listen to her, you know. Should have snapped right back at her. Why did you sit there listening to her nonsense?"" Ishan, although regretful, still looked a bit angry.

""Well, you did it for him, so it's okay now."" Hardik casually said before going back to eating again. Rishabh was still smirking at Shubman, and he had no idea why. So, ignoring him, Shubman went back to his food too."
